{
  "schema_version": "1.0",
  "transaction_id": "txn_demo_1002",
  "batch_id": "batch_demo_0001",
  "created_at": "2026-08-29T18:00:02Z",
  "updated_at": "2026-08-29T18:00:05Z",
  "status": "SUCCEEDED",
  "input": {
    "client_reference": "checkout-1002",
    "occurred_at": "2026-08-29T18:00:01Z",
    "merchant_id": "merchant_br_01",
    "provider_id": "provider_alpha",
    "issuer_bank": "bank_br_b",
    "country": "BR",
    "currency": "BRL",
    "amount_minor": 25990,
    "payment_method_category": "DIGITAL_WALLET",
    "card_brand": null,
    "card_type": "NOT_APPLICABLE",
    "provider_connection_id": "conn_br_primary",
    "channel": "MOBILE"
  },
  "processing": {"stage": "COMPLETE", "progress_percent": 100, "failure_code": null},
  "outcome": {"result": "SUCCEEDED", "provider_response_code": "00", "normalized_decline_code": null, "latency_ms": 318},
  "classification": {
    "category": "APPROVED",
    "reason": "The provider approved the authorization.",
    "confidence": 1,
    "evidence_ids": ["evt_demo_1002_final"],
    "related_incident_ids": []
  },
  "correlation_id": "corr_demo_batch_0001"
}
